id,status,title,description,allowed_files,allowed_deps,tests
BUG-1,in_review,"Wire facilitator to Coinbase","Replace the mock verify/settle stubs with real HTTP calls to the Coinbase x402 facilitator while keeping mocks available via env flags.","backend/src/facilitatorClient.js|backend/src/server.js","none","node backend/src/server.js; curl -i http://localhost:3000/joke; node backend/agent/agent.js \"tell me a joke\""
BUG-2,open,"Align frontend with paid API","Point the Vite UI at GET http://localhost:3000/joke, surface the 402 requirement, and display the paid joke/audit result so users can run the flow from the browser.","frontend/src/App.jsx|frontend/src/main.jsx|frontend/src/index.css","none","npm --prefix frontend run dev; exercise paid flow in browser"
BUG-3,in_review,"Implement Locus client","Replace the mocked authorizeSpend/fetchAudit logic with real calls to the Locus API so the CLI buyer can spend using the provided wallet keys.","backend/agent/locusClient.js|backend/env.sample|bugreport.csv","none","node backend/src/server.js; curl -i http://localhost:3000/joke; node backend/agent/agent.js \"tell me a joke\""
BUG-4,in_review,"Align agent with env sample","Update the CLI agent to consume LOCUS_* env vars (wallet, mocks) instead of CDP-specific names so the provided env.sample works out of the box.","backend/agent/agent.js|backend/env.sample|bugreport.csv","none","node backend/agent/agent.js \"tell me a joke\""
BUG-5,in_review,"Use Locus in agent loop","Replace the direct wallet signing in the CLI agent with calls to locusClient.authorizeSpend/fetchAudit so X-PAYMENT headers come from Locus policies.","backend/agent/agent.js|backend/agent/locusClient.js|backend/env.sample|bugreport.csv","none","node backend/agent/agent.js \"tell me a joke\""

